track_id,audio_path,sa_note,verified,title,film,year,singer,artists,music_director,writers,genre,label,isrc,track_no,notes
lag-ja-gale-lata-1964,audio/lag_ja_gale_lata_1964.wav,G,false,Lag Ja Gale,Woh Kaun Thi,1964,Lata Mangeshkar,,,,,,,,Example row — replace with your labels
tum-bin-jaoon-kahan-mohd-rafi-1969,audio/01 Tum Bin Jaoon Kahan.m4a,,false,Tum Bin Jaoon Kahan,Pyar Ka Mausam (Original Motion Picture Soundtrack),1969,Mohd. Rafi,Mohd. Rafi,R.D. Burman,R.D. Burman & Majrooh Sultanpuri,Bollywood,Saregama,INH100161270,1,
deewaana-deewaana-a-r-rahman-2025,audio/04 Deewaana Deewaana.m4a,,false,Deewaana Deewaana,Tere Ishk Mein (Original Motion Picture Soundtrack),2025,A.R. Rahman,A.R. Rahman & Irshad Kamil,A.R. Rahman,A.R. Rahman,Bollywood,Super Cassettes Industries Private Limited,INS182504117,4,
abhi-mujh-mein-kahin-sonu-nigam-2011,audio/05 Abhi Mujh Mein Kahin.m4a,,false,Abhi Mujh Mein Kahin,Agneepath (Original Motion Picture Soundtrack),2011,Sonu Nigam,Sonu Nigam & Ajay-Atul,Ajay-Atul,Ajay Gogavale & Atul Gogavale,Bollywood,Sony Music Entertainment India Pvt. Ltd.,INS171101350,5,
jalte-hain-jiske-liye-talat-mahmood-1950,audio/06 Jalte Hain Jiske Liye.m4a,,false,Jalte Hain Jiske Liye,Sujata (Original Motion Picture Soundtrack),1950,Talat Mahmood,Talat Mahmood,S.D. Burman,S.D. Burman & Majrooh Sultanpuri,Bollywood,Saregama,INH109236680,6,
tum-bin-jaun-kahan-pt-1-kishore-kumar-1969,"audio/08 Tum Bin Jaun Kahan, Pt. 1.m4a",,false,"Tum Bin Jaun Kahan, Pt. 1",Pyar Ka Mausam (Original Motion Picture Soundtrack),1969,Kishore Kumar,Kishore Kumar,R.D. Burman,R.D. Burman & Majrooh Sultanpuri,Bollywood,Saregama,INH101300482,8,
tum-bin-jaun-kahan-pt-2-kishore-kumar-1955,"audio/09 Tum Bin Jaun Kahan, Pt. 2.m4a",,false,"Tum Bin Jaun Kahan, Pt. 2",Pyar Ka Mausam (Original Motion Picture Soundtrack),1955,Kishore Kumar,Kishore Kumar,R.D. Burman,R.D. Burman & Majrooh Sultanpuri,Bollywood,Saregama,INH109531170,9,
